jobTitel,Company,Location,jobDescription,postDate
Data Engineer | Database Developer | BI-Consultant (f/m/d),Apleona,"Isenburg, Germany","We are looking remote and Europe-wide / EU-wide for aData Engineer | Database Developers | BI Consultant (f/m/d) - 11022
Start your Apleona career remotely, at a location of your choice in Europe/ EU or a combination of both. If you decide to work remotely, we are looking forward to welcome you 2-3 days per quarter in our corporate headquarters in Neu-Isenburg.
It is also possible that you work from one of our many European locations, eg Cologne, Munich, Berlin, Hamburg, Vienna, Zurich, London, Warsaw, Dublin or Madrid - we are flexible!
We are APLEONA - around 20,000 dedicated colleagues | over 100 locations in more than 30 countries | one of the leading companies in the facility management industry.
Our BI & Data Analytics department in Apleona IT transforms data into meaningful information. On basis, we create products and services, both for Apleona internally and for our international customers. Our ambition is to create the basis for better and faster decisions.
Job Description:
Identify customer requirements, search for solutions in existing architectures and develop practical solutions in close coordination with the customer.
Build and operate analytics products & processes from A to Z (analytics, reporting, exploration, planning, reporting) together with the team
Manage and improve the data warehouse incl. interfaces
Analyze, monitor and improve data quality
Ensure scalability for the analysis of increasing data volumes
Your Qualifications:
Professional experience as a Data Engineer with a focus on Business Intelligence / Analytics, Data Analytics and Data Warehousing.
Profound knowledge in SQL, Data Vault 2.0 as well as the creation of Tabular models
Expertise in Microsoft SQL and MS Analysis Services (Tabular) as well as MS Integration Services
Experience in report creation with PowerBI, Reportserver, PowerBI embedded and DAX
You are familiar with Windows Toolstack, with Powershell and .Net, C# is familiar to you from the daily work with Visual Studio and Git
You have already worked out complex data models
Experience in the management and administration of cloud applications as well as with Azure, Data Factory, Azure Database and Wherescape is an advantage
A degree with a focus on computer science, business informatics, data engineering, data analytics or a comparable qualification is a plus
Fluent in English, German language skills are nice to have
APLEONA Advantages:
Secured future and a permanent employment contract
Flexible working hours and possibility of mobile working
Familiarization with an appreciative team of specialists
APLEONA - continuing education programs for personal and professional development
Professional working environment with challenging and exciting tasks
Numerous other benefits
Please contact us:
For further inquiries, please contact
Katharina Ries-Zink+49 (0) 6102/ 45 3723mein.job@apleona.comWe look forward to receiving your complete application documents with details of our JobID 11022 , your next possible starting date and your salary expectations.We ask personnel consultants and service providers to refrain from contacting us. The telephone number and e-mail address provided are for applicants only.
Our job postings are open to all suitable applicants regardless of gender, age, disability, religion, ideology, ethnic origin or sexual identity.
We at APLEONA operate and manage real estate and properties for our national and international customers and offer the complete range of real estate services. We stand for innovative, future-oriented and high-performance solutions. The key to our success is the permanent commitment and know-how of our employees as well as long-term and sustainable customer relationships.",09/05/2022
Digital Analyst / Digital Data Analyst (m/w/d),Adolf Würth GmbH & Co. KG,Germany,"Job Description


employment type
full time
permanent employment



Full job description



Würth is a leading manufacturer of fastening technology for professional use. As real doers, we are always passionate about what we do. High self-motivation, great creative freedom and a strong sense of collegiality characterize the culture in our family company Würth. Does that sound good to you? Then discover your entry opportunities now and become part of the Würth family. It's time for a new challenge.


Digital Analyst / Digital Data Analyst (m/f/d) - up to 80% remote possible

in Künzelsau

What awaits you:

You are responsible for the planning, conception and further development of the web and app tracking setup for Würth Germany in close coordination with Digital Marketing, taking into account the legal framework (data protection).
You will carry out and create attribution analyzes and customer journey analyzes as well as other web and app analyzes in close coordination with digital marketing.
The design and creation of reports in the field of digital marketing is also part of your area of ​​responsibility.
They ensure the linking of online and offline data from Würth's Omnichannel to enable data-driven decisions.
They procure the relevant data from the existing databases.
You will work closely with colleagues from the areas of digital marketing, big data, data analytics, data protection and Würth IT.

What we expect:


You have successfully completed a university degree or comparable training with an analytical focus in the areas of e-commerce, e-business, digital marketing and have several years of experience in online marketing / digital marketing and/or specifically in the field of digital analytics.
You have relevant professional experience in web & app tracking solutions such as Google Analytics, Piwik and tag management systems.
Initial experience with consent management systems and their role in tracking is an advantage.
Programming skills in SQL and/or Python complete your profile.
You convince with a structured and result-oriented way of working, strong communication skills and your ability to work in a team.
You bring along very good spoken and written German.


We offer you:

A permanent, full-time position with immediate effect.
Benefit from flexible working hours, trust working hours and mobile / home office (with up to 80% of the working hours).
You can look forward to performance-related pay and extensive social benefits.
Enjoy a family working atmosphere and at the same time an exciting working environment in a socially committed company and dynamic global corporation.
Benefit from regular and diverse further training offers at our own academy, diverse health and cultural offers as well as numerous employee benefits (e.g. company canteen, free drinks, fitness courses, reduced memberships / employee conditions, sabbatical, e-bike leasing).
You work with a high degree of independence and freedom to make decisions.



Convinced? Then we look forward to receiving your application via our online application form.


Adolf Würth GmbH & Co. KG 74650 KünzelsauT +49 7940 15-1680 personal@wuerth.com www.wuerth.de/karriere",16/05/2022
Data Engineer (m/f/d) Analytical Event Processing,Axel Springer Digital GmbH,"Berlin, Germany","Full job description



Berlin

Experienced Hire
Part Time / Full Time




We are looking for passionate and creative people who want to take an active part in shaping the future of journalism within the context of digital media. Are you open to trying new things? Are you confident, driven and clever? Then apply for a role now with Axel Springer National Media & Tech.
You will be part of Axel Springer's Big Data Platform Team, a small agile group that creates and supports company-wide data-driven products.





Become a

pivotal member of our data team who makes ""analytical event processing as a service"" as easy as possible.
build and maintain a scalable analytical event processing platform (based on Snowplow) that is easy to use for the whole organization
technically own the whole event processing platform, which includes performance, usability, reliability and infrastructure
perform data processing and modeling on large data volumes and build data objects for further analysis
make event data useable by everyone in the organization and support collaboration
provide data governance and event design support
teach and learn best practices from everyone in the organization





you are a

person who sees things holistically and wants to take technical ownership of an emerging data product.
you are proficient in building and running event processing pipelines, ideally with Snowplow and AWS
You have hands-on skills with distributed data technologies (e.g. Spark) as well as infrastructure experience with AWS services
you know event processing paradigms and design processes accordingly
you are proficient in 1+ programming languages: Python or Scala ideally being one of them
you don't need to know everything from the start but you like to take on responsibility and are eager to learn
you check-in, review, test and deploy your code daily and actively apply practices like DRY, SOLID and clean code
you speak fluent English. German would be a plus (no actual requirement, but willingness to learn)
working in agile teams and projects is second nature to you





Benefit from a

chance of boosting your personal development with seminars, workshops, various conferences and talks
your personal growth is important to us: we offer training and learning lunches, tech conferences, a budget for workshops and much more to expand your knowledge and skills
flexible working time and the possibility to work remotely enable you an ideal work life balance (10 day work within the EU are inclusive)
30 days of vacation and a €3.50 lunch subsidy OR free lunch in our on-site restaurant every day and 28 vacation days - your choice!
top-notch office equipment (also for your remote work space and private usage), up-to-date hardware, software and modern office spaces that provide you with maximum flexibility - no matter where you are working
a permanent full- or part-time position in a modern office in the heart of Berlin: www.axelspringer-neubau.de/
Getting curious? Check out what we are doing on GitHub or check out our Techblog.








Apply now!







Axel Springer National Media & Tech is the central pillar for Tech & Product and Central Functions of Axel Springer's German media offerings. We ensure that our strong national brands (including BILD, WELT) are optimally positioned to drive journalism forward. We are looking for new colleagues who are not dizzy at our pace of change and who want to actively shape the future of the media with their own ideas.








Questions and answers about the application process
The most frequently asked questions and their answers can be found on our FAQ page: career.axelspringer.com/en/faqDiversity is an essential part of our corporate culture! We are looking forward to receiving all applications regardless of gender, nationality, ethnic and social origin, religion, ideology, disability, age, sexual orientation and identity.You can find information about the representation for the severely disabled at Axel Springer here: career.axelspringer.com/en/ksbv
Contact person for this position (reference number REF199O) is Marcel Burmester #LI-MB2





Where do I want to work?",22/04/2022
Data Engineer / Data Analyst (f/m/d),DekaBank Deutsche Girozentrale,"Frankfurt am Main, Germany","Full job description


Ref. no.: 50037511 / Frankfurt am Main / full-time




Deka Investment GmbH is a subsidiary of DekaBank, the securities house of the Sparkassen-Finanzgruppe. It is part of the Securities business division, in which the Deka Group's securities fund business is bundled. As an investment company, Deka Investment focuses on the management of securities funds for private and institutional investors. The range includes both ""classic"" products such as equity, pension or money market funds as well as innovative offers such as life cycle, value protection or target funds as well as products for special target groups such as foundations or municipal institutions.









She expects:

In your position, you will be involved in the development of a proprietary data science application based on R/Shiny for the programmed evaluation of capital market data for the front office of the fundamental portfolio management department (CIO office, stocks, bonds, multi-asset)
You analyze the investment process of the Fundamental Portfolio Management division and develop new analysis modules and their interactive integration into the GUI via R Shiny (or HTML and JavaScript)
The creation and connection of internal databases is also one of your tasks
You will also assume technical responsibility and maintenance of the application (documentation, management of access rights, logging, etc.)
You communicate and (re-)present the results at top management level
Last but not least, they take part in internal and external further training opportunities, especially in the areas of statistics, data science and IT systems







You bring:

Studied business informatics with a focus on statistics and an above-average degree
Excellent programming skills in R and R Shiny, Python, Windows Console/PowerShell, HTML (CSS), JavaScript and knowledge of Java, C and C++ would be an advantage
Sound knowledge of business and economic methods of capital market analysis
Possibly first experience with git and agile working with SCRUM
Very good knowledge of German and English










Your structured and analytical ability to think leads to a great understanding of complex relationships, which you communicate confidently in the operational team and at top management level and with regard to which you can formulate and implement creative and efficient solutions. You work independently and goal-oriented and with a high degree of self-discipline in terms of detail and structure of your work, which is also reflected in the high quality of your work. You are a team player and are characterized by absolute integrity and commitment. A sense of responsibility completes her profile.









Look forward to an attractive environment:




Flexible working hours


Deka Sport


Employer-funded pension


Mobile working


Canteen/Meal Allowance


Continuing education


health Management


Job ticket RMV area


bike leasing









Have we piqued your interest? We are looking forward for your online application! If you have any questions, please do not hesitate to contact our applicant management at bewerbermanagement@deka.de. Please note that for data protection reasons we are not allowed to accept any applications or additional documents by post or email. Thank you for your understanding.









Susanna Conrad






Stina Borcott
+49 (0)69 7147-3999






Julia Master",22/04/2022
Data Platform Engineer ‏ (d/f/m),Henkel AG,"Düsseldorf, Germany","At Henkel, you can be a game changer and craft your career. Unleash your entrepreneurial spirit by bringing your ideas to life within a global team. Our leading brands and technologies, along with our high-performing businesses will provide you with countless opportunities to develop your skills and explore new paths. Your career at Henkel will contribute to a more sustainable future, while you grow within our vibrant, diverse culture of trust and belonging. If you’re up for challenging the status quo, join our team of pioneers and make your mark on the future with us.
Do you dare to make an impact?
YOUR ROLE
Lead technology/product exploration, evaluation, selection, standardization, and innovation in dx Data & Analytics
Design and build an innovative Data & Analyitcs platform
Develop and manage adaptation into Henkel needs and standards
Align capabilities and offerings with external providers and partners
Liaise with internal technology and infrastructure stakeholders at Henkel to ensure seamless and secure integration in the Henkel IT ecosystem
Provide ongoing solution optimization
Support technology strategy development
Advice Data & Analytics projects and business user on using platform architecture and technologies



YOUR SKILLS
Excellent university degree in computer sciences or comparable disciplines, ideally with focus on Data & Analytics architecture
At least 6 years of experience in large-scale Data Warehouse and Data Lake architecture design and implementation
Knowledge of modern data platform design, Cloud infrastructure and platform automation (infrastructure as code)
Experience in Microsoft Azure technology stack (Synapse, Analysis Services, SQLDB, ADLS2, Databricks, Power BI)
Good knowledge of Continuous Integration/Continuous Deployment with Microsoft Azure and PipelinesPowerShell scripting Experience with C#, .NET or Python preferred
Excellent English language skills, German is a plus
Exceptional initiative and strong analytical thinking
Ability to drive innovation and to solve complex tasks in a dynamic and challenging environment
Effective communication and persuasion skills
Henkel is an equal opportunity employer. We evaluate qualified applicants without regard to gender, origin, culture, mindset, generation, disability, religion and sexual orientation.


JOB ID: 21020522
Contract & Job type: Full Time, Regular
Contact information for application-related questions: Recruitment-Germany@henkel.com
Please do not use this email address for sending your application or CV. To apply, please click on the ""Apply Now"" button below. Applications sent via e-mail will not be accepted",02/05/2022
Junior Data Analytics Manager (m/w/d),Da Vinci Engineering GmbH,"Frankfurt am Main, Germany","Full job description


We are looking for smart and innovative employees for customers like Daimler, Porsche and Bosch who want to make a difference. If you would like to work in a dynamic team with flat hierarchies, we look forward to seeing you!
Your tasks:
Setting up and technical implementation of data analysis projects
Automation of data integration and reporting routes
Consulting and training of business users in graphical analysis technologies such as KNIME and PowerBI
Further development and maintenance of small server structures and software products
Your profile:
Completed degree in business informatics or comparable training
Good programming skills in eg Python, R or Java
Experience in model-driven analysis platforms, esp. KNIME
Basic knowledge of cloud and big data technologies, especially Spark in AWS
Safe Linux knowledge
Didactic and rhetorical suitability for independent workshop implementation with customers
Willingness to travel (up to 3 days a week)
Very good knowledge of German and English
It awaits you…
Experience in exciting and international projects
Continuous salary development
Da Vinci Corporate Benefits
Training on the job and language courses
Appreciation, motivation and commitment
Hardly anything motivates as much as success. Da Vinci Engineering is committed to the success of its employees. Become a part of us!",25/04/2022
Data Engineer,West CAP,"Berlin, Germany","Full job description




On our path to becoming the world's favorite way to shop, we’re assembling an unparalleled global talent network, accelerating individual careers, and disrupting entire industries. We are on a mission to liberate humanity from all the meaningless time spent managing their purchases and finances, so they can do more of what they love. We’re in search of global talent eager to embrace a hypergrowth atmosphere and defy their own expectations.
Engineering at Klarna is an inspired, customer-focused community, dedicated to crafting solutions that redefine our industry. Working in small, highly collaborative Agile teams, you and your team will have a clear mission and ownership of an important outcome that supports Klarna and our customers. At Klarna we optimize for quality, flow, fast feedback, focussing on end-to-end ownership, continuous improvement, testing, monitoring, and experimentation. We aim for teams that are inclusive, helpful, and have a strong sense of ownership for the things they build.
Our engineers make some of the most significant decisions for the company and we are looking for bold, open, and curious developers. As a Klarnaut, you’ll be inspired to contribute to the growth of Europe’s most highly valued fintech and your work will reach millions of users.



What you'll get to do
Ensure data quality and consistency
Collaborate with our Data Team to get access to new datasets, the most out of our existing ones, and ensure the usability of data
Consult with analysts and business users to build and continuously improve a variety of data products that create value for our business
Make sure we have access to all of our relevant KPIs
Develop all necessary automated reports for teams to perform and be the go-to person for any data question




Some of the technologies you’ll get to work with
Python
SQL
AWS (Redshift, S3, EC2, EMR)
Airflow
Git
Wait
We also believe in contributing back to the open-source community. You can find some of our work here https://github.com/klarna.




To succeed in this role, we think you should have:

Experience with leading teams and support Engineers in their career development
Several years experience in software and data engineering with one or more general-purpose programming languages, including Python, and experience with Cloud technologies.
Excellent communication and problem-solving abilities across competencies - Stakeholder management will be a big part of your day to day
Working experience with data visualization tools, including but not limited to Qlik Sense.
Working proficiency in English
Willingness to learn new technologies and move between different tech stacks



How to apply: please send us your CV or Linkedin profile in English

What we offer:

Diversity & Community
With our diversity of skills, perspectives and backgrounds, we can create, innovate, and disrupt like no other. Diversity is part of who we are, and essential to our success.

Ownership & Impact
Here, every voice matters. We’re organized into hundreds of small teams, each run like a start-up, focused on their own problem-space.

Trust & Collaboration
Successes and failures are won together at Klarna in a melting pot of teams. Win, lose, and learn, we’re on this path together.
The Klarna Work Policy is designed to make sure we foster team collaboration while also ensuring a productive and flexible work environment. We work 2 days per week in the office on agreed days, and then 3 flexible days. We’re also providing each Klarnaut with an annual financial contribution to improve their flexible work life whether they use it to upgrade their work accessories, or their home office space!

Challenges & Rewards
We take a very Swedish approach to benefits. Support for parents, health and wellness perks—we’ve got you covered.

About Klarna
Since 2005 Klarna has been on a mission to revolutionize the retail banking industry. With over 90 million global active users and 2 million transactions per day, Klarna is meeting the changing demands of consumers by helping them save time and money while better managing their cashflow and making informed decisions. Over 250,000 global retail partners, including H&M, Saks, Sephora, Macys, IKEA, Expedia Group, and Nike have integrated Klarna's innovative technology to deliver a seamless shopping experience online and in-store. With over 5,000 employees, Klarna is active in 20 markets and is one of the most highly-valued private fintechs globally, with a valuation of $45.6 billion. For more information, visit Klarna.com
It is our commitment that every qualified person will be evaluated according to skills regardless of age, gender, identity, ethnicity, sexual orientation, disability status or religion. Please refrain from including your picture and age with the application.",18/04/2022
