jobTitel,Company,Location,jobDescription,postDate
Senior Consultant - Data Governance (m/f/x),OSTHUS GmbH,"Remote (Aachen, Germany)","ABOUT US:
OSTHUS brings innovative scientific informatics applications to many of the world’s largest pharmaceutical, Crop Sciences and Life Sciences companies. We provide both software solutions as well as consulting expertise to help guide your business strategy in adopting valuable technologies. With teams of unique interdisciplinary experts, we help our clients solve new kinds of global data-driven challenges in Pharma and Life Sciences.

WHAT WE OFFER YOU:
Working in a professional team without rigid structures
Opportunities to contribute with and develop your own ideas
Many opportunities to develop personally and professionally.
We offer individual coaching, training, language courses, and online training
Working in international teams with flat hierarchies
Flexible working hours and home office options
Team events, such as breakfast together, bowling, a summer party, and a Christmas party
Adequate remuneration and company pension scheme

HERE’S WHAT YOU’LL DO:

You lead international projects and you are the central contact person for the business department and customers
You develop strategies and concepts for data quality management, mainly working with IDQ from Informatica
Introduction of data governance frameworks 
Conduction of data management maturity assessments at our customers
You lead the development and management of databases
You build strong relationships with our customers and you conduct workshops and meetings
Leading sales process and content management of data governance marketing campaigns


WHAT YOU NEED TO SUCCEED: 

You have a complete study in computer science, business informatics, natural sciences or comparable
Experience in the development and implementation of data quality strategies
You have experience in leading project teams
Knowledge of data management and data quality tools, preferably with Informatica or Collibra
A strong customer orientation and professional communication style
You have an ability to analyze complex issues and question them critically
You have very good knowledge of the English language, in speech and writing
First experience in the field of life science is a plus

A FEW TIPS ON HOW TO APPLY: 
You were mentally checking boxes on our requirements? Great! 
 Please e-mail your application and résumé to career@osthus.com. Make sure to include the following: 
When you would like to start at OSTHUS, 
how much you would like to earn with us, and
what attracts you to this job with us. 
Finally, refer to “Senior Consultant - Data Governance (m/f/x)” in the subject line.
This way, we can get a good picture of how well we fit together. You can address your application to our colleague Frauke Nonne.  
If you have any questions upfront, please do not hesitate to contact us via email or simply send us a message via WhatsApp: +49 151 11435345.
Thank you for your time and your interest! We look forward to hearing from you.",18/05/2022
Data Warehouse Inhouse Consultant Microsoft Business Intelligence w/m/d,Computacenter,"50170 Kerpen, Germany","Data Warehouse Inhouse Consultant Microsoft Business Intelligence w/m/d








Location: Germany - Kerpen, Germany - Frankfurt, Germany - Cologne, Germany - Ratingen | Job ID: 147321 | Business area: In-house IT | Career Level: Professionals
Your tasksYour colleagues and managers from sales, logistics and many other departments have a lot of questions - and you have the answers with your solutions. Because you are part of an international business intelligence team and inspire with your competence and personality and advise your internal customers as an analyst and developer in the internal data warehouse environment.
Your field of activity includes:
Du bist erste Kontaktperson, wenn es um die Analyse von komplexen Reporting-Anforderungen aus Deinen unterschiedlichen Fachbereichen geht. Dabei hältst Du als Expert:in engen Kontakt zu den wichtigsten Stakeholdern sowie Usern und berätst diese hinsichtlich Inhalt und Gestaltung von neuen bzw. der Erweiterung der bestehenden Produkte. Dein Ziel: die höchstmögliche Kundenzufriedenheit und Sicherstellung der Wettbewerbsfähigkeit unserer Lösungen.
In your role, you like to be responsible for the concept, modeling and implementation of sophisticated business intelligence solutions and support all phases of the development process (requirements analysis, design, technical development, report development, quality assurance, testing and deployment) using the latest Microsoft development tools and SQL Server versions. You are open to modern data warehouse approaches and ideally have already gained initial experience in the MS Azure Cloud.
You ensure ongoing production operations in cooperation with various teams. In the event of a problem, you know the technical and functional details and support qualified third-level support.
your profile
Business or technical training and/or a relevant degree, e.g. B. (business) informatics
Enjoy playing a decisive role in shaping the future of both your team and the group-wide reporting platform
Good knowledge of database development and design, ideally in the Microsoft Business Intelligence environment
Initial experience in cloud BI (Azure BI, Synapse) or ML and AI is an advantage
Analytical thinking and a structured approach
Enjoy working in an international team
Willingness to constantly develop personally and professionally
Confident presentation skills in English and German
We offer
Mobile working and flexible working hours - trust is good. Point.
Vacation - time out? At least 30 days holiday plus custom days, paid special leave and sabbaticals.
Further development – ​​we invest in you! Whether internal or external training, specialist or management careers, conferences, events, mentoring or coaching.
Culture – The “you” applies to us across all levels. We are approachable - and simply ourselves.
Family – What counts for us is what counts for you! We offer marriage and childbirth benefits, family service support—and much more.
about us
Computacenter is an international IT company with a 40-year track record. In Germany alone, around 7,000 people are driving the digital transformation forward: They develop IT strategies, implement new technologies or manage complex infrastructures - for the majority of DAX companies as well as for large public clients.
As an independent partner of all leading IT manufacturers (such as Microsoft, Apple, IBM, HP, Cisco, Intel), we are active in all relevant technology areas: from cyber security, cloud and artificial intelligence to agile software development and Workplace solutions for the Smart Factory.
And the best thing about us? Quite simply: the people who work for us, in their diversity, with their potential and their individual life plans.
Sounds good? Is also good! Apply now.
Your online application
We look forward to your online application, regardless of gender, age, sexual orientation, nationality, ethnic and social background, or religion. Applications from severely disabled people are welcome at Computacenter and will be given preference if they are equally suitable.
Ready to apply?
This works best via our job portal. Just click on the ""Apply Now"" button and off you go!
Questions about the job?
Then send an email to JANINA.JANSEN@COMPUTACENTER.COM.",11/05/2022
Working Student - Machine Learning / Data Science - Product Development (m/f/d),Aon's Assessment Solutions,"20457 Hamburg, Germany","Full job description


Aon's Assessment Solutions provides clients with powerful tools and insights to help them make better talent decisions at every stage of the employee lifecycle. This includes pre-hire assessments, identifying future leaders, screening for digital skills and agility, and AI-enabled solutions. Aon's Assessment Solutions undertakes 30 million assessments each year in 90 countries and 40 languages.
Come and join our fabulous team as we continue to build our reputation for excellence.
AAS Innovation Team delivers breakthrough assessment solutions based on technology and psychological science.
The team is committed to delivering on time and on focus. Deliveries include technologies, research projects, patents, publications, marketing materials, and implementations.
The team drives AAS effort in creating ground-breaking innovation. Team members are encouraged to share and evaluate ideas. Furthermore, they assist colleagues across AON Assessment Solutions and that have innovative ideas. Out-of-the-box innovation is nurtured through quarterly side projects in which we research on frontier topics.
the position
We are looking for an ambitious and curious working student in Germany. The primary location is Hamburg, but we are open to a remote solution within Germany. The position is fully in English. No level of German is required.
As part of the Innovation Team, you will support us in a variety of research projects laying the groundwork for future solution development and research driving innovation in personnel selection.
You will get the behind-the-curtains experience of how innovative psychometric tests and systems are developed, and you will practically apply your scientific and mathematical skills to an impactful and growing industry.
core activities

Innovation research: You will support the team in exploring new technologies and their applications. This involves reading, understanding, and summarizing existing scientific, and specialistic from different disciplines
Research-oriented coding: You will support us in data preparation, prototype modelling, microservice API and in writing Python, MATLAB, R, Java, or C/C++ codes.
Scientific writing: You will help the team in writing patents and papers
Presentations: You will help prepare and deliver internal presentations to the team and stakeholders.
Testing and research: You will help plan and implement internal studies to evaluate the effectiveness of new methodologies.

Skills and Qualifications

You are enrolled as a student with a main emphasis on computer science, mathematics, engineering, quantitative science or data science
You have a good understanding of probabilities, statistics, and hypothesis testing
You have some knowledge about machine learning/AI methods
You know coding principles and have working proficiency with Python
You are familiar with one or more deep learning libraries (e.g. Keras, Pytorch, Tensorflow, etc.)
You are passionate about research and are keen to learn more about behavioral science
You catch up on things quickly, work with attention to detail, and on your own initiative
You adapt quickly to changes and are open-minded
You would like to work with us for at least 12 months (internship up to 3 months, working student 9+ months)
You are proficient in English
You enjoy collaborating with experts from diverse cultural and academic backgrounds
(Preferred but not required) A proven track record of scientific publications, with preference in ML/CV/NLP/Speech journals / conferences.

What we offer
Our company emphasizes pioneer thinking, client-centricity, career progression, and personal and professional integrity. This includes having…

a stimulating work environment
flat hierarchies and open-minded international teams
a supportive and responsive team culture
Opportunities to learn in a dynamic and fast paced working environment
Being engaged in innovative and stimulating project",25/04/2022
Data Analyst (m/w/d),AOK-Bundesverband,"10178 Berlin, Germany","Full job description







A variety of tasks await you



Database queries and processing of billing data from statutory health insurance for use in research projects
Organization and implementation of secure data transmissions to external research institutions
Product management and quality assurance of an AOK internal data analysis tool
Big Data & Analytics: Linking different data sources to sophisticated analytical solutions





Your skills



Experience in analytical work in the Big Data environment
Very good knowledge of relational database systems (e.g. Oracle, MS SQL Server) and data modelling
Security in programming with SQL and Python or R
Experience in the practical application of methods of data analysis: statistics, simulation and optimization, machine learning
Practical know-how in the application of data science methods
Very good written and spoken German language skills Enjoy working in an interdisciplinary team





These are your benefits



Meaningful and responsible tasks that you can identify with
Great creative freedom in your daily work
Diverse opportunities to reconcile work, family and private life





We will gladly answer your questions



We look forward to receiving your application by May 12, 2022 . Please understand that for data protection reasons we can only accept applications via our online form.
Christian Günster (Phone 030 34646-2128) is at your disposal for more detailed information on the area of ​​responsibility .
If you have any questions about the application process, please contact our human resources department (phone 030 34646-2882).",16/04/2022
Analyst:in Business Intelligence/Reporting,SV SparkassenVersicherung,Deutschland,"For our Business Intelligence & Data Analytics Sales group we are looking for an
Analyst:in Business Intelligence/Reporting
The group with around 5,000 employees and several locations is part of the Sparkassen-Finanzgruppe and offers all types of insurance. We are ideally positioned on the market with innovative products. Our focus is on the customer, but sustainability and social commitment are also important to us.
We offer:

An exciting and challenging field of activity in a motivated team.
This responsible, varied job with a high degree of personal responsibility and theOpportunity to actively help shape the SV.
A performance-related salary, extensive social benefits and an above-average Retirement provision.

Your main tasks:

You evaluate customer data to optimize future sales events.
You develop potential analyzes of buying affinity, cancellation forecasts and provide supportother things, the pilot phases in sales.
You will be involved in the strategy project Focus Customer in providing data.
You drive the development of the tool for sales controlling and reporting.
You create requirements for the transfer of the sales Big Data use cases into operative Systeme.
You define interfaces and accompany the entire process.
You will work closely with specialist contact persons from the sales departments and marketing
and the sales and cooperation partners.

 
Your profile:

You have successfully completed a degree in computer science, mathematics or a comparable subject. Ideally, you already have professional experience in this area or have completed comparable professional training.
You have knowledge of SQL and have a strong affinity forData, numbers and technical systems.
You are proficient in using MS Office productsideally have initial experience in dealing with businessintelligence systems and the financial sector.
They are characterized by a quick wit, good skillsin problem analysis and in the consideration of procedural connections as well as goal- and result-oriented work.
Ideally, they have properties such as resilience,assertiveness and teamwork.

 
Have we piqued your interest? Then we look forward to receiving your application! 
Online at www.sv-karriere.de.Your contact person in Human Resources is Mr. Bernd Schmid (Tel. 0711 898-45658).",03/06/2022
Intern (f/m/d) Data Science / Business Analytics,Drees & Sommer,"48155 Münster, Germany","Full job description





Your tasks
Would you like to gain valuable and practical experience in the field of data science and business analytics and support us in the further development of our project management processes? Then we are looking for you as an intern to support our team. You will take on these tasks:Support in the analysis of company, project and market data
Participation in merging complex data from different data sources and developing BI solution concepts
Participation in the conception and implementation of BI, data warehouse and reporting projects
Support in the design of new user solutions for the optimization of typical processes with master and mass data as well as inventory and transaction data in deadline, cost and quality management in the construction and logistics industry
Presentation of quantitative and qualitative information as results in dashboards, reports and reports
your profile
Studies in the field of business mathematics, business informatics, business administration or a comparable course
Good knowledge of common MS Office programs
Initial knowledge of programming (preferably VBA, Python and/or R), initial experience with relational databases (e.g. SQL) or object-oriented programming languages ​​(C++, JAVA, or similar) are desirable
Confident team player (m/f/d) with an analytical, open and committed approach
Assertiveness and high social skills
We offer
Individually tailored student mentoring
Modern and ergonomic workplaces
Access to the corporate benefits portal, free drinks and fresh fruit
Employee referral program, networking events, team workshops


Opt for spirit,fun and diverse tasks



CAREER BROCHURE







Your contact person

Julia Kessen




APPLY NOW




your place of work

Drees & Sommer SE
At Mittelhafen 10
48155 Munster






follow us",13/04/2022
Remote - Senior Data Scientist (m/w/d),Steadforce GmbH,"Homeoffice-Coaching, Tacitusstraße, Cologne, Germany","Job Description


employment type
full time



Full job description

Your tasks
Using methods of mathematics, computer science and statistics, you gain information from large amounts of data that can be beneficial for Steadforce and our customers.
You recognize patterns and connections, derive hypotheses from them, test them and present your results as a basis for decision-making.
You design and develop end-to-end data science or AI solutions for our customers from various industries.
As a senior data scientist, you will actively participate in the planning and development of research prototypes.
Where others see a data jungle, you recognize new business models and process optimization approaches.
your profile
You have a degree in a MINT subject.
You have 2-5 years of professional experience or have a doctorate in the STEM field.
You have very good know-how in statistics and ideally experience with linear and quadratic optimization.
You have good knowledge of various machine learning methods.
You have experience in the preparation and exploration of data as well as in the design and implementation of data pipelines.
Good knowledge of the Python data science stack is part of your technological portfolio.
You are fluent in German - and very good in English.
Ideally, you have experience with container solutions such as Docker.
Experience in software development (Java or C#) and with cloud technologies (AWS or Azure) is a great advantage.
*Your Benefits*
Attractive remuneration, flexible working hours, working time account and part-time models.
Your choice of high-end tools: iPhone, MacBook or ThinkPad.
Contingent hours within the ""Steadforce Campus"" at your disposal for individual further training.
Central office with modern equipment and good transport connections.
Motivated, collegial and dynamic working atmosphere.
Private accident insurance.
An annual contribution to the company pension scheme.
Great company events: annual kick-off party, cooking events, Oktoberfest, roof top events.
Award as a ""family-friendly company"" (Family Office).
Corporate Benefits, Job Wheel, Gaming Room and much more.....
Steadforce develops scalable, secure and sustainable digital platforms and turns visions into reality.With over 100 experts, we solve the most complex challenges.Steadforce realizes all of our customers' visions at a high professional level. We work methodically, with attention to detail and great enthusiasm for everything we do. We guide our customers through their data value chain, which includes:
Determination of data requirements and review of existing data
Connect data, services and devices in real time
Analyzing data, making predictions, making decisions based on data
Automation of workflows, applications and processes
From Co-Creation to Dev and Ops to Evolve, our holistic service portfolio enables continuous innovation, end-to-end monitoring, rapid modernization and successful collaboration until business goals are achieved.We create perfectly customized solutions for our customers. Well-known companies benefit from our know-how.Learn more about us at www.steadforce.com
Location: Westenstrasse, 80686 Munich
Type of position: full-time
Working hours:
Monday to Friday",25/05/2022
Data Analyst Intern/ Working Student (m/f/d),Statkraft,"Düsseldorf, Germany","Full job description



Data Analyst Intern/ Working Student (m/f/d)


Location: Düsseldorf


Start date: ASAP


Are you passionate about working with data?


Are you looking to start a career as a Data Analyst? You could help solve the climate crisis with Statkraft. This is your chance to realise the potential of renewable energy and make a positive impact on our planet.


Why Statkraft?


Statkraft has been making clean energy possible for over a century. That’s what we offer. 125 years of unrivalled expertise in supplying the world with what it needs most. We envision a world that runs entirely on renewable energy. Because in the fight against climate change, we don’t see renewable energy as part of the solution – we believe it must be the solution and we need your help in doing that. With us, you’ll shape and build a career that is truly forward-facing with many amazing opportunities and offerings to match.


Working in Digitalization, Software Development & Analytics in Trading & Origination:


As part of the Trading & Origination Department, the Digitalization Unit is an exciting and newly established division with the specific remit of driving forward Statkraft’s digitalisation agenda. The Digitalization team will play a crucial and fundamental role in enabling the Trading & Origination function delivers on its strategic targets of expanding both the proprietary trading and customer service businesses.


The new function will work in partnership with the Trading & Origination teams building a competitive edge for our commercial business via data and digitalization. Working as part of a high performing team, it is anticipated that the Digitalization Unit will quickly be able to make an impact through innovative process improvement, knowledge share and project delivery. It will also provide an essential strategic partnering bridge between the needs of the business and the IT solutions available.


The role:


The role will support strategic projects and initiatives for development of high-quality data & analytics solutions to meet the current and future business information demand.


It will focus on many different analytics tools and users, from Python developers, IT professionals, Citizen developers and BI developers.


The role will include:




Setup processes to extract and load large data sets


Extend and continue to build out our team’s dashboard analytics


Manage and monitor our automated tasks



About you:





University student/graduate enrolled in Computing, Maths, Electrical Engineering or similar degree


Knowledge of programming (preferably Python) is an advantage


Detail Oriented and delivery focus


Ability to capture data and analyze


Fluency in German language is an advantage





What we offer


A career with Statkraft is a career filled with purpose – meaning that every employee is not just making a living, they are making a real difference to the planet, our communities and the future. Together, we work on the front lines of changing the game for renewable energy. From hydrogen development to algorithmic trading and everything in between. We have 125 years of unrivalled expertise in creating the technologies that put ecosystems, communities and our environment first. With us, you’ll shape a career that is truly forward-facing with many amazing opportunities and offerings to match.



Unlimited learning opportunities at various levels of the organisation including Linkedin Learning and inspiring leaderships program like IMD






The chance to grow your career alongside a truly global network of experts, leaders, specialists and graduates from different countries and backgrounds


The opportunity to work somewhere with pride, and to be able to honestly say “My work is contributing to saving the planet”


A work culture that puts emphasis on the individual, offering flexible working solutions, parental leave and work life balance principles


A focus on fun outside of work, supported by various activity groups such as soccer, yoga, sailing, climbing, boxing, cabin rentals, and much more


Being part of a company proudly certified as a ‘Great Place to Work’ (Germany only).




Statkraft offers competitive terms of employment and benefits schemes, and we’re a trusted employer that puts the safety of our people first. We believe that a safe and healthy working environment is a matter of choice, not chance.


Statkraft manages critical infrastructure and services in several countries. The applicant must be eligible for security clearance and authorisation.",11/04/2022
