jobTitel,Company,Location,jobDescription,postDate
Werkstudent Data Science (w/m/d),MARTIN GmbH für Umwelt- und Energietechnik,"80807 Munich, Germany","Job Description


employment type
part time
working student



Full job description

Your tasks
Support for our specialist departments in project business, with a focus on research and development:
Analysis & evaluation of different data sources
Automation of evaluations and reports
Our family working atmosphere, a flexible, agile and helpful team provides support at all times.
your profile
We are looking for students (f/m/d) who
are enrolled at a university (technical focus)
10 to 20 hours per week are available
want to work on exciting tasks with enthusiasm and commitment
Have an affinity for technical innovation, data science, machine learning
have the will and willingness to develop further
analytical thinking and a structured way of working
have good communication skills and enjoy working in a team
have initial experience in dealing with programming languages ​​relevant to data science (Matlab, Python, C++, R, SQL, etc.).
are confident in dealing with the common MS Office applications and the German language, both spoken and written
want to contribute proactively to the sustainable recycling of waste
We as an employer
We are looking for people who want to shape the future with us. Employees who think ahead with their commitment and enthusiasm. Therefore, we promote a positive working environment with room for personal initiative and openness: We live a culture that is characterized by appreciation and respect. The development of the potential of our employees is important to us - individual further training measures are therefore a matter of course for us.",27/04/2022
Data Warehouse Engineer (w/m/d),Debeka,"56073 Koblenz, Germany","Debeka – Seit unserer Gründung im Jahr 1905 leben wir das WIR. Unsere Kultur ist geprägt von persönlicher Nähe, Zusammenarbeit und gegenseitiger Unterstützung. Wir sichern die Zukunft von mehr als 7 Millionen Menschen in Deutschland – und sorgen dafür, dass sie im Notfall schnell wieder ins normale Leben zurückfinden.Jeder von uns ist ein wichtiger Teil einer starken Gemeinschaft. Vereint leisten wir einen sinnvollen Beitrag zum Gemeinwohl. Darauf sind wir stolz.Werden auch Sie Teil von etwas Großem! – Das Füreinander zählt.

Ihr Beitrag für das WIR
Entwicklung und Betrieb einer Data Warehouse Lösung
Konzeption und Integration unserer DWH- und Big Data Systeme
Extraktion, Prüfung, Optimierung und Analyse von komplexen Datenbeständen mit geeigneten Verfahren (z.B. ETL)
Konzeption, Implementierung und Qualitätssicherung von ETL-Prozessen
Erstellung von Transformationsvorgaben für Datenmappings
Mitwirkung bei der Umsetzung von IT-Projekten


Das wünschen wir uns
abgeschlossenes Studium der (Wirtschafts-)Informatik bzw. vergleichbares Studium oder eine abgeschlossene IT-Ausbildung
Know-how im Bereich BI-/DWH-Architekturen, -Technologien und -Implementierung inkl. Tools
gute SQL-Kenntnisse und Erfahrung mit relationalen Datenbanksystemen
Erfahrung im Umgang mit großen Datenmengen
Kenntnisse in der Programmierung von Anwendungen (C++ / Java-Kenntnisse) von Vorteil
strukturierte, analytische und lösungsorientierte Arbeitsweise
hohe Lernbereitschaft, Selbstständigkeit und Teamfähigkeit


Das bieten wir Ihnen
eine familienfreundliche Unternehmenskultur
30 Tage Urlaubsanspruch
gute Vereinbarkeit von Berufs- und Privatleben durch flexible Arbeitszeiten und die Kombination von Arbeit vor Ort und Homeoffice
überdurchschnittliche Sozialleistungen: vermögenswirksame Leistungen und betriebliche Altersvorsorge mit Arbeitgeberbeteiligung
übertarifliche Weihnachts- und Urlaubszuwendung
einen sicheren Arbeitsplatz mit einer unbefristeten Anstellung
eine umfassende Einarbeitung sowie Onboarding-Veranstaltungen für den idealen Einstieg ins Unternehmen
Unterstützung bei der Entfaltung Ihres Potenzials durch individuelle Förderung und Weiterbildungsangebote der Debeka-Akademie
vielfältige Karrieremöglichkeiten
Mitarbeiterparkplätze
zahlreiche Angebote rund um das Thema Sport und Gesundheit
attraktive Mitarbeiterangebote und -rabatte (wie z.B. JobRad)


Ihre Ansprechpartnerin
Jana KneipDebeka-HauptverwaltungFerdinand-Sauerbruch-Straße 1856073 KoblenzTelefon (02 61) 4 98 – 56 67jana.kneip@debeka.de",02/05/2022
Junior Data Engineer,RELX Group,"Bonn, Germany","Job Description


employment type
full time



Full job description



The LexisNexis Intellectual Property (IP) (https://www.lexisnexisip.com) division provides international patent content and a suite of on-line and analytical tools to meet the needs of the intellectual property market. We enhance and deliver data for the LexisNexis IP search and analytics applications, which provide our customers with insights and metrics supporting their business decisions.


Our corporate culture is driven by a commitment to excellence, innovation, and a strong dedication to our customers, employees and communities. You will be collaborating with stakeholders from different cultures and roles. It is a fun place to work with a vibrant and diverse team, giving you the freedom to grow and actively contribute.

We are looking to hire a Junior Data Engineer to join our growing team based in the Bonn region.
 
Your qualifications:


Bachelor's / Master's Degree (Engineering/Computer Science preferred but not required); or equivalent experience required.


Your responsibilities:

You will develop a deep understanding of patents and integrate and cross-connect them with a wide array of scientific, firmographic and legal data to create new insights for our customers
In your role as data engineer you will play a crucial role in developing our new data infrastructure based on your extensive technical knowledge in the field.
You take ownership of the data quality and performance and work continuously to improve them.

Your profile:

Had first experiences in data engineering and would like to continue along that path
Enjoy working in a global team developing creative solutions
1+ years of experience with Python or a similar modern scripting language
1+ years of experience working with Spark - experience with PySpark and DataBricks is beneficial
Basic proficiency with data manipulation language (in particular SQL)
Solid knowledge of software development methodologies
Self-driven, outstanding initiative and creative ideas.

LexisNexis, a division of RELX Group, is an equal opportunity employer: qualified applicants are considered for and treated during employment without regard to race, color, creed, religion, sex, national origin, citizenship status, disability status, protected veteran status, age , marital status, sexual orientation, gender identity, genetic information, or any other characteristic protected by law. If a qualified individual with a disability or disabled veteran needs a reasonable accommodation to use or access our online system, that individual should please contact accommodations@relx.com or if you are based in the US you may also contact us on 1.855.833.5120.
Please read our
Candidate Privacy Policy",27/05/2022
Business Intelligence Data Engineer (m/w/d),Fitness First Germany GmbH,"Frankfurt am Main, Germany","Job Description


employment type
full time
permanent employment



Full job description


Business Intelligence Data Engineer (m/f/d)


Location: Frankfurt Service Center


Type of employment: full-time


Your tasks

You are independently responsible for the further development of the existing group-wide business intelligence solutions with a focus on data warehouse (MS SQL Server) and data integration
You administrate and optimize the data structures in our DWH, connect new data sources, create automated data exports and ensure their function and quality
You will develop solutions for setting up and operating complex reporting and analysis products and processes (analytics, data marts, reporting, dashboards)
You push and coordinate company-wide data and reporting projects and assume responsibility for the full cycle of implementation - from requirement engineering to deployment and 3rd level support
You support management and the specialist department in the profitability-oriented control of business activities based on company-relevant KPIs and reports
You support the marketing and CRM team in expanding and optimizing the data platform with regard to data-driven marketing processes

your profile

You have successfully completed your studies in the field of business informatics/computer science (or comparable) and have several years of professional experience
You have in-depth knowledge of data warehouses and the use of common BI tools
You have good knowledge of Microsoft SQL Server and the Microsoft BI Stack (SSIS, SSRS, SSAS, Power BI, Excel)
Ideally, you have BI-relevant experience in the areas of controlling, accounting, CRM or marketing
You have knowledge of requirements engineering / requirements management and (agile) project management
You have a high degree of analytical and networked thinking and acting as well as conceptual skills and a quick grasp
You are committed and work in a structured and goal-oriented manner and enjoy working in a team



your advantages

capital accumulation benefits
Free membership
Free drinks
Employer-funded pension
employee discounts",13/05/2022
Senior Data Scientist (m|w|d),Voith Group,"Heidenheim an der Brenz, Germany","About the Voith GroupThe Voith Group is a global technology group. With its wide range of systems, products, services and digital applications, Voith sets standards in the markets for energy, oil & gas, paper, raw materials and transport & automotive. Founded in 1867, the group today generates sales of 4.2 billion euros with more than 20,000 employees. With locations in over 60 countries around the world, it is one of the largest family businesses in Europe.Support the Voith Group | Division Turbo asSenior Data Scientist (m|f|d)Job ID 67782 | Location Garching
import Studiesimport Languages ​​import German, Englishimport Professional experiencefrom Social_Skills import Ability to work in a team
class DataScientist:
def __init__(self):self.advanced_analytics_methods = ""Develop solutions for the challenging tasks of our global Voith Turbo production.""
self.build_models = ""Evaluate and implement models for automatic pattern recognition and prediction from structured and unstructured data.""
self.find_added_value_for_production = ""Find new ways to capitalize on available production data and gain valuable new insights for Voith Turbo production. "" \""Collaborate with process engineers to generate breakthrough research hypotheses""""that you will later use of machine learning models and then implement them in the productive environment.""
self.project_management = ""Be the interface for communication between non-specialist departments and the fascinating world of data science.""
def search(self, applicant):if ((databases(applicant) == ""Is well-versed in dealing with relational database technologies (SQL) and time-series-based database technologies (Influx)"") and(programming languages(applicants).Experience_in_years >= 5 and programming languages( Applicant).Language == ""Python,R_Statistics or Java"") and(Studies(Applicant) == ""Has successfully completed a degree in computer science, mathematics, physics or engineering or has a comparable qualification."") and(Professional experience(applicant).Years >= 5) and(German(applicant) == ""Excellent knowledge of spoken and written"" and English(applicant) == ""Good knowledge of spoken and written"") and(Teamwork (applicant) == ""His communication skills and solution focus characterize him/her just as much as his/her enjoyment of working in a team"")):print('We have found our new data scientist! %s!' % Applicant )else:print('Unfortunately we have to keep looking!')
CONSOLE
>>> from DataScientist import *>>> DataScientist.suche('DU')'We have found our new data scientist! Apply to join our team!'
Working at Voith means actively promoting sustainable technologies. We offer you a responsible job in a dynamic team in our Turbo division with challenging tasks and freedom for your creativity. In addition, there is much more that sets us apart. Become a Voithian too and shape the future of our company with us.
Apply now via our online portal with your detailed application documents (including certificates).
Everything you need to know about the application process can be found here.
JM Voith SE & Co. KG | VTA looks forward to your application!
Your personal contact
JM Voith SE & Co. KG | VZS
Global Business Services HR EMEA
Recruiting Services • Johannes Hummel • Tel. +49 7321 37 2042
voith.com/career",04/05/2022
Bachelor/Master/Intern (m/w/d) - Bioinformatics & Data Science,LEUKOCARE AG,"Planegg, Germany","Full job description




Join our bioinformatics team in Munich
We are currently seeking to fill this exciting, versatile and diverse role in a professional, cooperative and appreciative environment, where you can actively help shaping the success of the company. We offer a flat organization, a monthly stipend, flexible working hours, mobile working, and last but by no means least a highly transparent and dynamic company culture. Team Thunder (bioinformatics/biostatistics) is a self-organised scrum team within Leukocare that conducts innovative research on biopharmaceutical formulation development. As a research student in our team, you will extend our data mining to new sources, integrate the data into machine-learning pipelines, and test hypotheses relevant to scientists in the field of formulation development.



Your Responsiblities

establish and extend python software for mining of data from public sources
follow procedures for writing maintainable code, based on pair-programming, code reviews, testing, and refactoring
conduct data analysis using machine-learning or classical statistics
read and analyse relevant scientific article
create and test hypotheses based on expected or observed patterns in the data



Your Qualifications

enrolled at a German university (Universität or Hochschule) as a student of biology, chemistry, bioinformatics or a related field
good programming skills, preferably in python
excellent communication skills in English and/or German
enthusiasm for working in a dynamic, interdisciplinary environment involving rapid change and continuous learnin
experience working in protein biochemistry, protein sequence analysis, or with viruses is a plus
experience in the pharmaceutical industry or a related medical field is a plus



About Us
Leukocare AG is a rapidly growing, international biotech company located in Martinsried/Munich and Milford, MA, USA. Based on our technology platform, we develop superior and innovative drug product formulations combining state-of-the-art analytical technologies with innovative bioinformatics approaches. Together with our partners within pharmaceutical, biotech and the medical devices sector, we apply our formulation technologies and expertise to stabilize complex proteins, vaccines & viral vectors.",25/04/2022
(Junior) Data Analyst / BI Developer (w/m/d),Daimler Group Services Berlin GmbH,"Berlin, Germany","tasks




Daimler Group Services Berlin (DGSB) is a wholly owned subsidiary of Daimler. As a shared service center for the AG and its subsidiaries, we offer innovative solutions in the areas of finance, controlling and HR. With more than 1,300 employees in Berlin, we contribute to the economic success of the group and are constantly developing!As soon as possible , we are looking for an employee for the design, development and implementation of dynamic management reporting/dashboards using current BI tools such as PowerBI for further support.These exciting tasks await you, for example:Participation in workshops with internal customers to coordinate and develop product requirements
Support/moderation in the definition and documentation of KPIs/content

- Support in building SAP solutions with a focus on planning and reporting applicationsDesign of intuitive reports for desktop and mobile devices
Structure of relevant data models (to create reports)
Design and implementation of authorization management for the reports
Technical concept creation of required interfaces/system connections
Operational processing of reports that are already in operational mode







qualifications




You bring the following professional skills to us:Education: Completed studies, ideally in business administration, business informatics or comparable trainingIT skills:Experience in creating reports and dashboards, e.g. B. with Microsoft PowerBI, Tableau, QlikView

- Experience in SAP planning and analytics portfolio desirable (BW4/HANA, SAC, BPC, DWC, DI)Very good knowledge of MS Office applications, in particular Excel and Power Point as well as VBA
Basic knowledge and expertise in the field of business intelligence
Good understanding of databases
Experience with Azure Databricks, Azure Data Factory, Azure VMs, Azure SQL, Power BI Service desirable
Languages: Business fluent knowledge of German required, business fluent knowledge of English desirable.You bring the following personal skills to us:Personality: Strong communication skills, empathy and willingness to learn characterize you.Working method: You have a strong awareness of quality, a good understanding of service and are open and flexible to new challenges. Your analytical, independent and process-oriented way of working completes your profile.You don't bring everything with you?Don't worry, we are looking for employees who convince us above all with their personality and are motivated to give full throttle with their team!

We offer:Working under the starry sky: You can expect structured training and a collegial environment in which it is fun to work.Employee conditions: Remuneration is based on the collective agreement. Attractive employee discounts, great team events, holiday and Christmas bonuses await you.Work-life balance: We offer you flexible working hours from 6 a.m. to 8 p.m. (with flextime system), 30 days of vacation and the possibility of mobile working (e.g. home office).New ways of working: We offer light-flooded open-plan offices with future-oriented workplace concepts such as desk sharing and height-adjustable tables.We don't do it entirely without formalities either. We therefore ask you to submit your application exclusivelyonline and with a desired salary .We are particularly pleased to receive applications from severely disabled people and people with disabilities who have the same status. You can also contact the severely disabled representative of Daimler Group Services Berlin at Severely disabled representation_DGSB@daimler.com, who will be happy to support you in the further application process.Find out more about us and your options HERE.

Applying and working in times of CoronaWe recruit digitally: Digital solutions make it possible to conduct interviews and selection processes from any location, thus avoiding a health risk for everyone involved.We work mobile:Even before the Corona crisis, we practiced mobile working and continue to use it more intensively due to the current situation.We'll get you on board safely: Our onboarding and individual training in the team are mostly digital.Your contact for questions: Ju-Mi, Tel.: 030/88721 4634, recruiting.dgsb@mercedes-benz.com",27/04/2022
Specialist – focus on data science and econometrics (m/f/d),Institut der deutschen Wirtschaft Köln,"50668 Köln, Germany","Job Description


employment type
full time



Full job description

IW Consult Career Entry Science / Scientific Consulting Specialist – Focus on Data Science and Econometrics (m/f/d)
We have a passion for problem solving. They also? We should get to know each other. For our Data.Insights.Future area. we are looking for a specialist – focus on data science and econometrics (m/f/d) as soon as possible.
This is what you can expect from us:
Independent implementation of data-driven, empirical and econometric analyses
Further development of methods and models (especially in the areas of web scraping, analysis of large (un)structured data sets, panel and microeconometrics)
Writing scientific studies and publications
Presentation of the study results at the customer's site
Project management and participation in quotation processes
This is what we want from you:
Studies in economics or a similar course with a focus on econometrics or statistics
Experienced handling of Stata, R or Python as well as a feeling for technical solutions
Sound methodological knowledge in the field of econometrics and/or data science
Affinity for complex data sets
Enjoyment and linguistic skills in the preparation of scientific studies with very high quality standards
Our offer:Over 30 in-house seminars and individual external training | Flexible working hours | Mobile working | Free job ticket | Direct proximity to the Rhine and the main train station | Cafe Lounge | Silent Rooms | 30 vacation days | Brown Bag Sessions | Design Thinking Room | Team events & networking formats | Yoga, full body training & Co | Sabbaticals | Parent-Child Room | Gym | Company pension schemeLocationKonrad-Adenauer-Ufer 2150668 Cologne
Type of position: full-time",16/05/2022
Data Analyst (m/f/d),MediaMarktSaturn,"80939 München, Germany","Full job description


MediaMarktSaturn MarketingLocation: Munich, IngolstadtContract type: Permanent
MediaMarktSaturn is Europe’s leading consumer electronics retailer. It sees itself as a partner, daily companion and navigator for its customers in the digital world. Its over 1,000 MediaMarkt and Saturn stores are closely integrated with their online shops. MediaMarktSaturn has a total headcount of more than 53,000.
About Us
As a Data Team at Media-Saturn Marketing, our Data Analytics & Marketing Platform specialists generate actionable insights to increase sales, customer engagement and improve targeting and campaigns for MediaMarkt and Saturn in an international environment. If you want to help us analyzing marketing data and creating value from data, then apply now.
Your tasks
Build and maintain dashboards in Tableau and Google Data Studio for digital marketing and CRM
Conduct deep dive analyses with actionable recommendations and conclusions
Perform ad-hoc reports and provide insights to your stakeholders as a basis for decision making
Development and implementation of data-driven use cases
Requirements
University degree in the field of Data or Computer Science, Business, Economics, or Information Management
Several years of analytical and database experience.
Experience in analyzing marketing and customer data (e.g., digital advertising, e-commerce and CRM data) to gain insights and use them to manage marketing campaigns
Equipped with good knowledge in SQL and dashboarding tools such as Tableau, Google Data Studio or any other data analytics tools
Good communication skills, ability to speak and write in German fluently
Benefits
Flexible working hours and sabbatical leave
Individual trainings and development offers
Pension plan
Employee discounts
Sport and health offers
Free parking and good traffic connections
Subsidized canteen and cafeteria
Employee events
Interested? We are looking forward to receiving your application!HR Contact: Bianca ReglerPhone number: 0841/6341097ID-No.: 46322",18/04/2022
